{
  "id": "srd5-monsters",
  "name": {
    "ru": "Монстры SRD (образцы)",
    "en": "SRD monsters (samples)"
  },
  "entry_type": "monster",
  "entries": [
    {
      "id": "giant-rat",
      "name": {
        "ru": "Гигантская крыса",
        "en": "Giant Rat"
      },
      "data": {
        "size": "small",
        "type": "beast",
        "ac": 13,
        "hp": 7,
        "hit_dice": "2d6",
        "speed": 30,
        "cr": "1/8",
        "abilities": {
          "str": 7,
          "dex": 16,
          "con": 11,
          "int": 2,
          "wis": 10,
          "cha": 4
        },
        "attacks": [
          {
            "name": "Bite",
            "bonus": 5,
            "damage": "1d4 + 3 piercing"
          }
        ]
      }
    },
    {
      "id": "goblin-warrior",
      "name": {
        "ru": "Гоблин-воин",
        "en": "Goblin Warrior"
      },
      "data": {
        "size": "small",
        "type": "fey",
        "ac": 15,
        "hp": 10,
        "hit_dice": "3d6",
        "speed": 30,
        "cr": "1/4",
        "abilities": {
          "str": 8,
          "dex": 15,
          "con": 10,
          "int": 10,
          "wis": 8,
          "cha": 8
        },
        "attacks": [
          {
            "name": "Scimitar",
            "bonus": 4,
            "damage": "1d6 + 2 slashing"
          },
          {
            "name": "Shortbow",
            "bonus": 4,
            "damage": "1d6 + 2 piercing"
          }
        ]
      }
    },
    {
      "id": "skeleton",
      "name": {
        "ru": "Скелет",
        "en": "Skeleton"
      },
      "data": {
        "size": "medium",
        "type": "undead",
        "ac": 14,
        "hp": 13,
        "hit_dice": "2d8 + 4",
        "speed": 30,
        "cr": "1/4",
        "abilities": {
          "str": 10,
          "dex": 16,
          "con": 15,
          "int": 6,
          "wis": 8,
          "cha": 5
        },
        "attacks": [
          {
            "name": "Shortsword",
            "bonus": 5,
            "damage": "1d6 + 3 piercing"
          },
          {
            "name": "Shortbow",
            "bonus": 5,
            "damage": "1d6 + 3 piercing"
          }
        ]
      }
    },
    {
      "id": "wolf",
      "name": {
        "ru": "Волк",
        "en": "Wolf"
      },
      "data": {
        "size": "medium",
        "type": "beast",
        "ac": 12,
        "hp": 11,
        "hit_dice": "2d8 + 2",
        "speed": 40,
        "cr": "1/4",
        "abilities": {
          "str": 14,
          "dex": 15,
          "con": 12,
          "int": 3,
          "wis": 12,
          "cha": 6
        },
        "attacks": [
          {
            "name": "Bite",
            "bonus": 4,
            "damage": "1d6 + 2 piercing"
          }
        ]
      }
    },
    {
      "id": "zombie",
      "name": {
        "ru": "Зомби",
        "en": "Zombie"
      },
      "data": {
        "size": "medium",
        "type": "undead",
        "ac": 8,
        "hp": 15,
        "hit_dice": "2d8 + 6",
        "speed": 20,
        "cr": "1/4",
        "abilities": {
          "str": 13,
          "dex": 6,
          "con": 16,
          "int": 3,
          "wis": 6,
          "cha": 5
        },
        "attacks": [
          {
            "name": "Slam",
            "bonus": 3,
            "damage": "1d8 + 1 bludgeoning"
          }
        ]
      }
    }
  ]
}
